{
  "body": {
    "evidenceDigest": "sha256:aaaaaaaaaaaaaaaaaaaaaaaaaaaaaaaaaaaaaaaaaaaaaaaaaaaaaaaaaaaaaaaa",
    "inventoryItemId": "item-1",
    "lane": "native-substrate-census",
    "selector": "bytes:0-12"
  },
  "critical": ["body.futureAuthorityOverride"],
  "kind": "output",
  "protocolVersion": "1.0.0",
  "requestId": "request-1",
  "schema": "fdir/adapter-protocol/1",
  "sequence": 0,
  "sessionId": "session-1"
}
