{
  "body": {
    "evidenceDigest": "sha256:aaaaaaaaaaaaaaaaaaaaaaaaaaaaaaaaaaaaaaaaaaaaaaaaaaaaaaaaaaaaaaaa",
    "inventoryItemId": "item-1",
    "lane": "native-substrate-census",
    "selector": {
      "byteLength": 12,
      "byteOffset": 0
    }
  },
  "critical": [
    "schema",
    "protocolVersion",
    "kind",
    "body.lane",
    "body.evidenceDigest"
  ],
  "kind": "output",
  "protocolVersion": "1.0.0",
  "requestId": "request-1",
  "schema": "fdir/adapter-protocol/1",
  "sequence": 0,
  "sessionId": "session-1"
}
