{
  "body": {
    "artifact": {
      "byteLength": 12,
      "digest": "sha256:aaaaaaaaaaaaaaaaaaaaaaaaaaaaaaaaaaaaaaaaaaaaaaaaaaaaaaaaaaaaaaaa",
      "handle": "artifact:source-1",
      "mediaType": "application/octet-stream"
    },
    "budget": {
      "maxChunkBytes": 512,
      "maxCpuMillis": 100,
      "maxDecompressionRatio": 20,
      "maxInFlightChunks": 2,
      "maxMemoryBytes": 4096,
      "maxObjects": 10,
      "maxOutputBytes": 1024,
      "maxRecursionDepth": 8,
      "maxTemporaryStorageBytes": 2048,
      "maxWallClockMillis": 1000
    },
    "capability": "test-native-census",
    "configurationDigest": "sha256:cccccccccccccccccccccccccccccccccccccccccccccccccccccccccccccccc",
    "contextDigest": null,
    "lanes": ["native-substrate-census"],
    "manifestDigest": "sha256:bbbbbbbbbbbbbbbbbbbbbbbbbbbbbbbbbbbbbbbbbbbbbbbbbbbbbbbbbbbbbbbb",
    "profile": "conformance",
    "replayKey": "conformance-replay-key"
  },
  "critical": [
    "protocolVersion",
    "body.manifestDigest",
    "body.artifact",
    "body.lanes",
    "body.budget",
    "body.replayKey"
  ],
  "kind": "execute",
  "protocolVersion": "1.0.0",
  "requestId": "request-1",
  "schema": "fdir/adapter-protocol/1",
  "sequence": 0,
  "sessionId": "session-1"
}
