{
  "body": {
    "artifact": {
      "byteLength": 12,
      "digest": "sha256:aaaaaaaaaaaaaaaaaaaaaaaaaaaaaaaaaaaaaaaaaaaaaaaaaaaaaaaaaaaaaaaa",
      "handle": "/tmp/untrusted-document",
      "mediaType": "application/octet-stream"
    },
    "profile": "conformance",
    "requestedCapability": "test-native-census",
    "requiredLanes": ["native-substrate-census"],
    "supportedVersions": ["1.0.0"]
  },
  "critical": ["body.artifact"],
  "kind": "client-hello",
  "protocolVersion": "1.0.0",
  "requestId": "request-1",
  "schema": "fdir/adapter-protocol/1",
  "sequence": 0,
  "sessionId": "session-1"
}
